[
  {"master_id":"EFFORT-EC2-BASIC-DESIGN","service":"EC2","task_type":"BASIC_DESIGN","unit":"SERVICE","person_days_per_unit":"1.0","role":"AWS_ARCHITECT","valid_from":"2026-01-01","valid_to":"2026-12-31","approval_status":"APPROVED","version":1,"schema_version":1},
  {"master_id":"EFFORT-EC2-DETAIL-DESIGN","service":"EC2","task_type":"DETAIL_DESIGN","unit":"INSTANCE","person_days_per_unit":"0.5","role":"INFRA_ENGINEER","valid_from":"2026-01-01","valid_to":"2026-12-31","approval_status":"APPROVED","version":1,"schema_version":1},
  {"master_id":"EFFORT-EC2-BUILD","service":"EC2","task_type":"BUILD","unit":"INSTANCE","person_days_per_unit":"0.5","role":"INFRA_ENGINEER","valid_from":"2026-01-01","valid_to":"2026-12-31","approval_status":"APPROVED","version":1,"schema_version":1},
  {"master_id":"EFFORT-EC2-UNIT-TEST","service":"EC2","task_type":"UNIT_TEST","unit":"INSTANCE","person_days_per_unit":"0.3","role":"INFRA_ENGINEER","valid_from":"2026-01-01","valid_to":"2026-12-31","approval_status":"APPROVED","version":1,"schema_version":1},
  {"master_id":"EFFORT-RDS-BASIC-DESIGN","service":"RDS","task_type":"BASIC_DESIGN","unit":"SERVICE","person_days_per_unit":"3.0","role":"AWS_ARCHITECT","valid_from":"2026-01-01","valid_to":"2026-12-31","approval_status":"APPROVED","version":1,"schema_version":1},
  {"master_id":"EFFORT-RDS-DETAIL-DESIGN","service":"RDS","task_type":"DETAIL_DESIGN","unit":"DATABASE","person_days_per_unit":"1.0","role":"INFRA_ENGINEER","valid_from":"2026-01-01","valid_to":"2026-12-31","approval_status":"APPROVED","version":1,"schema_version":1},
  {"master_id":"EFFORT-RDS-BUILD","service":"RDS","task_type":"BUILD","unit":"DATABASE","person_days_per_unit":"0.5","role":"INFRA_ENGINEER","valid_from":"2026-01-01","valid_to":"2026-12-31","approval_status":"APPROVED","version":1,"schema_version":1},
  {"master_id":"EFFORT-CLOUDWATCH-MONITORING-DESIGN","service":"CLOUDWATCH","task_type":"MONITORING_DESIGN","unit":"SERVICE","person_days_per_unit":"1.0","role":"AWS_ARCHITECT","valid_from":"2026-01-01","valid_to":"2026-12-31","approval_status":"APPROVED","version":1,"schema_version":1},
  {"master_id":"EFFORT-CLOUDWATCH-ALARM-CONFIG","service":"CLOUDWATCH","task_type":"ALARM_CONFIG","unit":"ALARM","person_days_per_unit":"0.1","role":"INFRA_ENGINEER","valid_from":"2026-01-01","valid_to":"2026-12-31","approval_status":"APPROVED","version":1,"schema_version":1}
]
